{
  "$schema": "/public/schemas/pennyworth-backup-v8.schema.json",
  "app": "Pennyworth",
  "schemaVersion": 8,
  "exportedAt": "2026-09-04T12:00:00.000Z",
  "user": {
    "email": "import@example.com"
  },
  "accounts": [
    {
      "id": "account-main",
      "name": "Main bank",
      "type": "bank",
      "currency": "EUR",
      "openingBalanceMinor": 100000,
      "institution": null,
      "isActive": true,
      "createdAt": "2026-09-04T12:00:00.000Z",
      "updatedAt": "2026-09-04T12:00:00.000Z"
    }
  ],
  "categories": [
    {
      "id": "category-food",
      "parentId": null,
      "name": "Food",
      "type": "expense",
      "color": "#d97706",
      "icon": "food",
      "createdAt": "2026-09-04T12:00:00.000Z",
      "updatedAt": "2026-09-04T12:00:00.000Z"
    }
  ],
  "tags": [
    {
      "id": "tag-imported",
      "name": "imported",
      "color": "#2563eb",
      "createdAt": "2026-09-04T12:00:00.000Z",
      "updatedAt": "2026-09-04T12:00:00.000Z"
    }
  ],
  "transactions": [
    {
      "id": "transaction-groceries-1",
      "type": "expense",
      "date": "2026-09-03T00:00:00.000Z",
      "amountMinor": 4599,
      "sourceAccountId": "account-main",
      "destinationAccountId": null,
      "categoryId": "category-food",
      "description": "Groceries",
      "notes": "Created from another system",
      "tagIds": ["tag-imported"],
      "createdAt": "2026-09-04T12:00:00.000Z",
      "updatedAt": "2026-09-04T12:00:00.000Z"
    }
  ],
  "budgets": [],
  "rules": [],
  "recurringTransactions": [],
  "assets": [],
  "assetPrices": [],
  "holdings": [],
  "investmentTransactions": []
}
